SID,label,sentence
43,1,वे आपकी अटारी में हो सकते हैं अगर वो सही से हवादार नहीं है।
317,0,"अच्छी बात है। अंतरिक्ष एक बहुत दिलचस्प जगह है। मुझे हाल ही में पता चला है, कि ऐसे ठंडे सितारे भी हैं जिन्हें हाथों से स्पर्श किया जा सकता है।"
161,1,"अपने कपड़े, बर्तन धोने, वगैरह के लिए, लेकिन यह पीने योग्य नहीं है। इसलिए सब बोतलबंद पानी पी रहे हैं।"
582,0,"तुम्हेंं पता है, अगर तुम्हारे ग्राहक को ऐसा लगे जैसे, ओह, मैं और ख़रीदूँगा। तो यह ऐसा लगता है जैसे, नहीं, यह अच्छी बात नहीं है।"
342,0,"क्या?!?!?!जब तुम कंप्यूटर पर Netflix देखते हो, तो समझ जाओ कि कैप्चा का मतलब होता है ""कंप्यूटर और मनुष्य में फ़र्क बताने के लिए पूर्ण रूप से स्वचालित सार्वजनिक ट्यूरिंग परीक्षण"""
26,1,"यह सही है! इसका निर्माण वाल्ट डिज़्नी एनिमेटेड स्टूडियोज़ ने किया था और रिलीज़ वाल्ट डिज़्नी पिक्चर्स द्वारा किया गया था। वो बहुत प्यारी थी! उन्होंने रापुंज़ल को टेंगल्ड नाम से फिर से बनाया था, क्या आपने उसे देखा है?"
245,1,इसलिए हर केस इस तरह का होता है जैसे अगर आप यह पता लगा सकते हैं कि अपने क्लाइंट्स को कैसे प्राप्त किया जाए और यह आपको पता है
29,1,"वाह, अपनी टीम के लिए बर्बाद करने के बारे में बात करना! क्या वह उस समय यांकी था या रेड सॉक्स, मुझे याद नहीं है"
534,0,इलेक्ट्रॉनिक्स के बारे में क्या ख्‍़याल है? क्या तुम्हेंं लगता है कि तुम्हेंं इलेक्ट्रॉनिक्स ख़रीदने की ज़रूरत है? क्या तुमने हाल ही में कोई इलेक्ट्रॉनिक्स ख़रीदा है?
246,1,मुझे लगता है आप समझते हैं कि यह दूसरे लोगों को समझाने की बात नहीं है कि आपका रिश्ता बहुत बढ़िया है और मैं इसके बारे हमें नहीं बता सकता
131,1,"यह शायद आपके फ़ेस बैटल में अमेरिकी शैली की तुलना में उनके विनम्र स्वभाव को बेहतर जचता है, जो बहुत भद्दा हो सकता है!"
115,1,मैं एक भूमिका के लिए इतनी मेहनत करने और उसे न पाने की कल्पना भी नहीं कर सकता! मैंने आयरनमैन पूरी की पूरी देखी है। और आपने?
295,1,"बेशक, जब भी आपको किसी से मदद की आवश्यकता होगी, वे पहुँच जाएँगे।"
289,1,"अच्छा, तो मुझे लगता है कि यह आपके खून में ही है।"
9,1,"शायद बहुत डरावनी, जहाँ तक मुझे पता है डरावनी फ़िल्म देखने से 180 कैलोरीज़ से ज़्यादा खर्च की जा सकती हैं"
180,1,क्या आपकी इस साल या अपनी ज़िन्दगी की दूसरी पसंदीदा फ़िल्में हैं?
471,0,"उस नेटवर्क का होना, बहुत बड़ा समुदाय है, इसलिए परिवार तुम्हारा सगा परिवार होता है, फिर तुम्हारे पीछे रहने वाले लोग,"
474,0,"हाँ, बिल्‍कुल। ठीक है, अब मेरे फ़ैशन स्टोर पर नजर डालो, तुम कहाँ से ख़रीदारी करते हो?"
188,1,"लेकिन उनमें से कोई भी जो आप कर सकते हैं, फ़्रीलांसर डॉट कॉम। मेरा वहाँ अकाउंट है"
440,0,"मुझे लगता है कि प्रतिभा परिवार में दौड़ती है, बातचीत काफी मनोरंजक थी, समय देने के लिए धन्यवाद"
362,0,"बेशक! तुमसे बात करके बहुत अच्छा लगा, अपनी रात का मजा लें!"
572,0,"इससे तुम्हारे पेट में दर्द होता है, ठीक है। मुझे लगता है कि तुम लैक्टोज बर्दाश्त नहीं कर पाते हो।"
204,1,"जैसे कि? ज़ि‍ंदगी कैसी होती है मुझे बताइए। और मैंने उससे कहा, सुनिए, ऐसे काम नहीं बनेगा। और मैंने कहा, मुझ पर एक एहसान कीजिए। वापस मत जाइए"
404,0,दिलचस्प बात है। एक UNICEF प्रोग्राम है जो तुम्हारे द्वारा अपने फ़ोन का इस्तेमाल न करने वाले हर मिनट के लिए स्वच्छ पानी डोनेट करता है।
478,0,तुम्हारा पसंदीदा कलाकार कौन है? मुझे लगता है कि एक ही बात जैसा है।
147,1,बहुत दुख हुआ कि वे उसका मज़ा नहीं ले सकते। आपको टॉम हैंक्स की कौनसी फ़िल्म पसंद है?
370,0,बहुत सही बात है। क्या तुम्हेंं पता है पोलो शर्ट का आविष्कार एक प्रसिद्ध टेनिस खिलाड़ी ने किया था?
409,0,"जिंदगी बहुत छोटी है। मुझे लगता है कि अगर तुम कर सकते हो, तो तुम्हेंं अपने सपनों का पीछा करना चाहिए। मुझे रयान स्टाइल्स पसंद हैं।"
584,0,"मैं उन्हें हर गर्मियों में देखता हूँ, वे सभी मिनेसोटा जाते हैं, क्या तुम्हेंं मिनेसोटा के बारे में पता है"
301,0,"नहीं, मैं नहीं। मैं यूरोप के देशों में वापस जाकर देखना चाहूँगा कि मेरे पूर्वज कहाँ से आए थे। अपनी आदि जड़ों का पता लगाना दिलचस्प होता है।"
476,0,"ठीक है, पेमेंट हो गया। AMC चुनने के लिए धन्यवाद, अपनी फ़िल्म का मज़ा लो। तुम्हारा समय अच्छा बीते।"
132,1,"उन्होंने इस बारे में जरूर कोई न कोई प्रेरणा महसूस की होगी। आपसे कॉमेडी के बारे में बात करके मजा आया, आपका दिन अच्छा बीते!"
544,0,"तुम्हेंं पता है मैं क्या कह रहा हूँ, तुम जो कुछ भी करना चाहते हो, तुम वह कर सकते हो। तुम जो करना चाहते हो, उसके लिए तुम्हेंं सब कुछ दिया जाए।"
494,0,"उन्हें पार्क ले जाना और उन्हें इधर-उधर भागने देना और थका देना, तुम्हेंं पता है मैं क्या कह रहा हूँ ताकि वे सोने जाएँ"
7,1,"मैं ढूंढ़ता हूँ, और प्रमुख वाक्यांशों की तलाश करता हूँ जैसे, ""गिव यू योर सोल"" और ""ऑर्गन हार्वेस्टिंग"" वगैरह :)"
185,1,आपको पता है मैं देख सकता हूँ कि ख़ास तरह की क़ानून स्थितियों के मुक़दमे में आप किस तरह होते हैं। आपको पता है यह असल में ऐसा है जैसे आप उठने और कहने के लिए कितने तैयार हैं
164,1,अपने परिवार से दूर रहने का सबसे मुश्किल पहलू कौन सा है?
467,0,"परदादा, तुम्हेंं पता है मैं क्या कह रहा हूँ, यह ऐसा ही होता है"
526,0,तुम्हारा आदर्श पेशा क्या है?
202,1,"मुझे इस बारे में नहीं पता। मुझे नहीं पता कि आपके साथ कभी ऐसा हुआ है या नहीं, मेरा मतलब है कि (अपने मुँह से अपना हाथ काटना) बहुत असामान्य है"
169,1,"सॉरी, हाँ, और इसलिए यह बहुत दिलचस्प है। तो विदेश यात्रा का आपका अनुभव कैसा रहा है?"
419,0,उम्मीद है तुम्हारी यात्रा बिली मेज़ के नीली शर्ट और खाकी पैंट वाले पॉलबीयरर्स के साथ यात्रा करने से अच्छी हो।
70,1,बहुत सही बात है। क्या आपको पता है पोलो शर्ट का आविष्कार एक प्रसिद्ध टेनिस खिलाड़ी ने किया था?
253,1,"लेकिन वे एक कर्मचारी की तरह होते हैं, जिनके पास पूरा करने के लिए सेल का लक्ष्य होता है और इसलिए अगर आप किसी का मेकअप करने में एक घंटा लगा देते हैं"
92,1,यह थोड़ी चौंकाने वाली बात है। मैंने ग्रैंड प्रिक्स या वैसा कुछ सोचा होता.... मैं शर्त लगाता हूँ कि लॉजिक मारियो कार्ट में आपको हरा देंगे!
165,1,"और उस पर दस डॉलर ख़र्च करना और फिर जैसे अपने परिवार को वहाँ ले जाकर पचास डॉलर का McDonald's मील खाना, इसका कोई मतलब नहीं है।"
47,1,"ये एक अच्छा सवाल है, कभी उसके बारे में सोचा नहीं। आप लोगों को अपने काम के बारे में गंभीरता से कैसे समझाओगे, मैं यहाँ इसलिए हूँ कि हो सकता है परग्रही कभी हमसे संपर्क करें।"
518,0,कितनी नौकरियाँ असल में ऐसी होती हैं। जैसे कोई व्यक्ति जोकि तुम्हारे बॉस की तरह अजीब और असुविधाजनक है?
585,0,"तुम समझ गए। वैसे, अगर बड़े होने पर मार्टिन तुम्हारा पसंदीदा शो था, तो अब तुम्हारा पसंदीदा शो कौन सा है?"
575,0,"ठीक है, हाँ, और इसके अलावा इस चीज़ की फ़्री शिपिंग भी है"
296,1,बैठ जाइए और सुनिश्चित करें कि आपके Twitter फ़ीड पर हर कोई असली मुद्दे को देख रहा है
34,1,"वे अद्भुत हैं, सच में मजेदार हैं! उन्हें लगता है कि कुंग फ़ू हसल कॉमेडी के मामले में आधुनिक युग की महान उपलब्धि है। मुझे उस बारे में नहीं पता था, यह एक बढ़िया फ़िल्म थी, लेकिन अद्भुत नहीं लोल आपको क्या लगता है?"
49,1,"यह बहुत पहले की बात है! वहाँ पर गार्डियंस ऑफ़ द गैलेक्सी के चीनी नाम के बारे में आप क्या सोचते हैं? यह है: इंटरप्लेनेटरी असामान्य हमला दल, लोल"
138,1,"कभी-कभार इंतज़ार करना अच्छा होता है। आमतौर पर जबर्दस्ती बनाए गए सीक्वेल बहुत निराशाजनक होते हैं। फिर भी, चूज़ों से अपना मनोरंजन प्राप्त करने से तो ये बहुत बेहतर है जैसा ब्रिटिश सीज़र के समय किया करते थे।"
207,1,"हाँ, आपको कहना पड़ेगा, हर किसी का अपना ख़ुद का रवैया होता है, आपको पता है मैं क्या कह रहा हूँ, हर किसी का अपना ख़ुद का ढंग होता है"
176,1,"ठीक है, पेमेंट हो गया। AMC चुनने के लिए धन्यवाद, अपनी फ़िल्म का मज़ा लें। आपका समय अच्छा बीते।"
141,1,हाँ। अब मैं एक अभिभावक के नाते से उन पर कदम रखता हूँ। क्या आप उनसे खेलते थे?
442,0,ठीक से पता नहीं। मैंने सिर्फ पहली वाली फ़िल्म देखी है। सुना है कि सबसे नई वाली फ़िल्म में एंजेला बैसेट हैं। मुझे वे बहुत पसंद हैं। तुम्हारे पसंदीदा सह-कलाकार कौन-कौन हैं?
500,0,"तुम्हेंं उन्हें कोशिश करने जैसे मूल्य सिखाने होंगे, जैसे चीज़ों को इस तरह करने की कोशिश करना, तुम्हेंं पता है कि मेरा क्या मतलब है?"
71,1,एवरेस्ट की चोटी पर भी आप अपनी लत से बच नहीं सकते। वहाँ 3जी सेल सेवा और इंटरनेट क्षमताएं हैं!
373,0,"मेरा कोई एक पसंदीदा नहीं है, लेकिन कई सारे हैं जो मुझे पसंद हैं। और तुम्हेंं?"
107,1,"शायद, सचमुच मेकअप से आपको किसी का भी रूप दिया जा सकता है"
522,0,"चलिए, हमारे छोटे से मनोरंजन के बारे में मुझे अपनी राय बताओ और हम पैसा नहीं बचा रहे हैं, लेकिन वह किताब असाधारण है, यह अलग-अलग तरह के बीमाओं के बारे में बात करती है जो तुम्हारे पास होने चाहिए।"
468,0,तुम्हारे पिताजी नंबर या किसी भी चीज़ का अंदाज़ा क्यों नहीं लगाते?
31,1,मैं भी वह खेलता था। क्या आप खेलते थे? टॉम हैंक्स के भाई ने वीडियो गेम में वुडी की आवाज़ निकाली थी?
325,0,"वाह, बहुत ही अजीब और दुख की बात है। खैर, क्या तुमने डफल बैग में मिले बाघ के बारे में सुना है?"
384,0,हाँ। क्या तुमने कभी जुरासिक पार्क राइड की सवारी की है?
574,0,"मुझे लगता है कि सिर्फ़ इसलिए, प्रजातियों के संदर्भ में, जैसा कि तुमने कहा, मनुष्य (विकसित) हैं। शायद कुछ अजीब लगा था। तुम्हेंं लगता है"
434,0,"हाँ, रहने के लिए एक दिलचस्प राज्य होगा। क्या तुम कभी वहाँ गए हो?"
397,0,"बहुत अजीब बात है, मैं तो बेशक करूंगा, क्या तुम अपनी यादों को अपलोड करोगे?"
168,1,आपके पिताजी नंबर या किसी भी चीज़ का अंदाज़ा क्यों नहीं लगाते?
60,1,"ट्रेन बढ़ रही है। आप बढ़ रहे हो। आप समान गति से बढ़ रहे हो। अगर आप ऊपर छलांग लगाओ, आपकी गति में परिवर्तन नहीं आएगा। अगर वह मुड़े और आप नहीं, तो आप दीवार से टकरा जाओगे।"
264,1,"आपको चीन से निकलने वाले इन सभी सस्ते कपड़ों को टैग करना होगा, क्योंकि कपड़े तेल के बाद और कार्बन फ़ुटप्रिंट में सिर्फ़ दूसरे स्थान पर हैं।"
532,0,तुम्हारी माँ हमेशा ऐसी लगती है
293,1,"मैं आपको दूँगा, मैं देख सकता हूँ कि क्या हम ऐसी जगह पर जा सकते हैं जहाँ आप अपने परिवार के सभी सदस्यों को देख पाएँगे।"
515,0,"इन चीज़ों को आज़माओ और कीमत कम करो। क्योंकि Airbnb के लिए मुझे काफी ज़्यादा कूपन दिखाई नहीं देते, जैसे कि अगर मैं जाता हूँ तो वे तुम्हेंं तुम्हारे पैसे नहीं देंगे"
517,0,"मैं देख रहा हूँ, इसलिए मैं कहता हूँ सिंगल और मिंगल रहो, ताकि तुम्हेंं किसी की भावनाओं और तुम्हेंं अपनी भावनाओं को ठेस पहुँचाने की चिंता न करनी पड़े"
68,1,बच्चों की फ़िल्में अब सेलिब्रिटीज़ के लिए पैसों के मामले में बहुत ज्यादा फ़ायदेमंद है। आपकी पसंदीदा बच्चों की फ़िल्म कौन सी है?
331,0,मैं भी वह खेलता था। क्या तुम खेलते थे? टॉम हैंक्स के भाई ने वीडियो गेम में वुडी की आवाज़ निकाली थी?
77,1,कैसा चल रहा है? क्या आपको खेल पसंद है?
337,0,मुझे लगता है कि प्रतिभा विरासत में मिल सकती है। मैं सोचता हूँ कि तुम्हेंं किस तरह के व्यक्तित्व की जरुरत होगी: सोचते रहने में वक्त बिताते हुए चाल और प्रति चाल के बारे में सोचना।
299,1,"करने के लिए हमेशा कुछ न कुछ होता है, मेरा मतलब है यह आपके समय के लिए योग्‍य है, जैसे मुझे अपना समय बर्बाद करने से नफ़रत है।"
242,1,तो हम परिवारों और उनसे जुडी चीज़ों के बारे में बात करने जा रहे हैं और आप यह सब जानते हैं
252,1,यह दूसरी बात है। आपको तुरंत सोचकर फैसला लेना होता है क्योंकि वे हमेशा ऐसे काम करते हैं जो अप्रत्याशित होते हैं।
50,1,ये सच है। वो बड़े होकर एक सच्चे हीरो बने! आपका पसंदीदा बैटमैन कौन था?
562,0,"तुम काम पर व्यायाम करते हो। एक संभावित बहाना। क्या तुम्हारे जीवन में कभी ऐसा कोई वक्त आया है, या था, जब तुम नियमित रूप से व्यायाम करते थे?"
156,1,"मैं बस वही करने जा रहा हूँ जो मेरे साथ हुआ था और वे सभी चीज़़ें चीन में बनी हैं, मैं बस यहाँ रुकने वाला हूँ।"
388,0,"हाँ, लोग यह भूल जाते हैं कि वे अपनी मर्जी से छोड़कर जा सकते हैं। मुझे वह ज्ञान और कौशल पसंद है। पूरी मीटिंग/डेट से अपना मनोरंजन करने के लिए खुद को चुनौती देकर तुम अपने मन में एक खेल भी खेल सकते हो।"
537,0,"तुम्हारी पसंदीदा फ़िल्में कौन सी हैं, तुम्हारी दूसरी पसंदीदा फ़िल्में और/या तुम्हारी इस साल की फ़िल्में कौन सी हैं?"
