SID,label,sentence
175,1,"Ja, genau. Okay, jetzt werde ich auch in meinen Modeläden nachsehen, wo kaufen Sie ein?"
63,1,"Das habe ich auch gemacht, und die Leute bewerten sie auf einer Skala von 1–5. Denken Sie, dass sich Menschen für die Schuhe ihrer Verabredung interessieren?"
281,1,"Ich denke nicht, dass da irgendetwas falsch daran ist. Aber, wenn ich Ihnen sagen würde, es schädigt die Wirtschaft, würde das Ihre Meinung überhaupt ändern? Und ich sage nicht, dass es"
451,0,"Weil das handgemacht ist oder, ich meine, es ist dazu gemacht, sich im Grunde innerhalb von einem Jahr zu zersetzen."
350,0,Das ist wahr. Er wurde erwachsen und ein richtiger Held. Wer war dein Lieblings-Batman?
326,0,"Das ist richtig! Produziert von Walt Disney Animation Studios und veröffentlicht von Walt Disney Pictures. Der war so süß! Sie haben auch Rapunzel als Rapunzel – Neu verföhnt neu verfilmt, hast du den gesehen?"
102,1,"Ich nicht, er hat eine tolle Stimme! Sie wissen, dass Stephen Fry auch ein Spielesprecher ist, er verleiht einigen Spielen seine Stimme."
492,0,"Sind sie bereit, an diesem Teil von deinem Leben teilzunehmen?"
341,0,"Ah, ein Mit-Weeb. Was ist dein Lieblings-Anime? Meiner ist wohl Death Note oder No Game No Life."
354,0,"Ja, es scheint so zu sein, oder vielleicht bei einer höheren Geschwindigkeit rotiert, weißt du, wir haben einen Botschafter für den Fall, dass Außerirdische auf dem Planeten ankommen oder versuchen, Kontakt zu uns aufzunehmen."
476,0,"Es ist wichtiger als Arbeit, es ist wichtiger als einen Job und eine Karriere zu haben, weil deine Karriere wird zu Ende gehen, deine Familie wird nicht zu Ende gehen. Deine Familie wird weitergehen, deine Blutlinie wird weitergehen."
182,1,"Das tun sie, sogar bei Bloomingdale‘s, sie nehmen auch, sie nehmen Ihr Make-up und so als Umtausch zurück."
89,1,"Nicht besonders … Ich liebe aber Sport, also könnte ich mich darauf einlassen, wenn ich müsste. Mögen Sie irgendwelche anderen Sportarten?"
539,0,"Was sind deine Lieblingsfilme, was sind deine anderen Lieblingsfilme und/oder deine Lieblingsfilme von diesem Jahr?"
548,0,"Ich denke, du verstehst, dass es nicht darum geht, andere Menschen zu überzeugen, dass deine Beziehung unglaublich ist und ich konnte uns davon nichts erzählen"
393,0,"Wie gehts, schaust du Horrorfilme? Die ersten waren von Edgar Allen Poe und Mary Shelley inspiriert."
30,1,"Also, selbst wenn Sie die DVD bei Netflix bestellen, müssen Sie Internet haben, um sie auf Ihre Liste von zu sendenden Dingen zu setzen."
502,0,"Hatte deine Familie überhaupt Einwände, als du ihnen gesagt hast, dass du Vegetarier bist?"
552,0,"Ich hoffe, dass ich dein Land bald besuchen werde. Das ist perfekt und einfach und süß und das ist es. Oh, das sagt es. Ich hoffe, es ist so."
536,0,"Wie sieht es mit Elektronik aus? Findest du, du bist jemand, der elektronische Geräte kaufen muss? Hast du in der letzten Zeit irgendwelche elektronischen Geräte gekauft?"
104,1,"Interessant. Es gibt ein UNICEF-Programm, das für jede Minute, die Sie Ihr Telefon nicht benutzen, sauberes Wasser spendet."
254,1,"Das ist eine weitere Sache. Sie müssen schnell reagieren können, da sie immer Dinge tun, die unerwartet sind."
62,1,"Mit Sicherheit! Es war so toll, mit Ihnen zu chatten, haben Sie eine gute Nacht!"
110,1,"Ja, manchmal fühlt es sich an wie ein ewiger Abgrund. Ich habe gelesen, dass Sie alle Gehaltsschecks Ihrer Kinder nehmen sollten, wenn sie ans College gehen. Lol, ich wäre durchgedreht, wenn meine Mutter versucht hätte, meine Schecks so einzuziehen."
531,0,"aber das glaube ich. Ich meine, durch die Online-Kurse lernen sie nicht genug. Einige von ihnen haben noch nicht mal mit Online-Kursen angefangen. Haben deine?"
263,1,"Aber wenn Sie, wenn sich die Person die Zeit nimmt, zu schauen, dann werden sie so sagen, oh, okay, ja, kein Problem, aber wenn Sie nicht nachschauen, dann kann ich Ihnen sagen."
397,0,"Das ist verrückt. Ich würde das auf jeden Fall machen, würdest du dein Gedächtnis hochladen?"
553,0,"Also, wie auch immer, und selber, was ist dein Lieblingskaufhaus? Weißt du was ich meine, wir machen den ganzen Bereich."
291,1,"Nun, ich denke, dann liegt Ihnen das wohl einfach im Blut."
556,0,"Lass uns über dein Lieblingsrestaurant sprechen, sehr interessant"
421,0,"Das ist wahr, deshalb frage ich mich, ob es noch mehr gibt, von denen wir nichts wissen, lol. Magst du Pferde?"
462,0,"Also, was ist dein idealer fester Freund?"
489,0,"Aber du könntest wirklich alle von denen machen, freelancer.com. Ich habe dort ein Konto."
315,0,"Ja, z. B. Wasserkraft. Computer von Apple scheinen ziemlich empfindlich zu sein, denn wenn du in der Nähe eines Apple-Computers rauchst, verfällt dadurch die Garantie."
474,0,"Wie, du weißt schon, für deine gesamten Versicherungen zahlen und versuchen, Auftritte zu finden und Auftritte anzunehmen, die du nicht nehmen willst."
153,1,"Nein, auf dem Rückweg von Budapest hatte ich tatsächlich die Möglichkeit, als meine Oma noch lebte. Sie wuchs in Budapest auf."
597,0,"Auf jeden Fall, sie sind einfach da, wann immer du eine helfende Hand brauchst."
171,1,"Nun, Gefühle waren in Ihrer Familie offensichtlich nicht erlaubt und sie waren auch in meiner Familie wirklich nicht erlaubt, es sei denn, es war Wut. Wir durften das Gefühl von Wut zeigen, denn das war alles, was jemand je gezeigt hat,"
430,0,"Das habe ich auch gehört. Hey, was hältst du von Morgan Freeman? Bis vor Kurzem wusste ich nicht, dass er damals in den 70ern Teil von The Electric Company war!"
27,1,"Ist ihr Name Anne Jones? Falls ja, könnten Sie einen Generator auf Ihre Bücher tun und den Strom verkaufen. Macht es Ihnen Spaß zu lesen?"
590,0,"Ja, du weißt, was ich meine. Die Zeit vergeht wirklich schnell."
411,0,"Wow, das ist unglaublich lange. Also, es war nett, mit dir zu chatten. Hab einen schönen Tag."
16,1,"Das mit Walmart stimmt. Aber mit Prime erhalten Sie Musik und Videos kostenlos. Auch Bücher für Ihren Kindle. Ich streame Videos, aber ist das ein großer Vorteil. Ich kaufe gelegentlich auch bei anderen Seiten ein – z. B. Geschenke bei Etsy."
347,0,"Das ist eine gute Frage, habe nie darüber nachgedacht. Wie genau würdest du deinen Beruf anderen ernsthaft erklären, ja, ich bin nur für den Fall hier, dass uns Außerirdische kontaktieren."
335,0,"Ja, ich verstehe nur einfach nicht wirklich den Sinn oder Reiz eines Button-Down-Kragens. Vielleicht, um deine Krawatte an Ort und Stelle zu halten, vorausgesetzt du würdest eine Krawatte tragen? Ich mag einfach nicht unbedingt, wie sie aussehen, haha."
160,1,"Wie schätzen Sie dann den Wert der Familie ein und wie, wenn Sie an Ihr Leben zurückdenken könnten, wie es ist"
338,0,"Ja, ich kann den Standpunkt verstehen. Ich dachte immer, dass es schon immer rot und blau war, aber das fing offenbar im Jahr 2000 an. Was waren deine Gedanken zu Harry Truman?"
124,1,Darüber weiß ich nicht viel. Haben Sie von dem generischen Comicheft gehört?
219,1,"Ich verstehe, genau darum sage ich immer, seien Sie Single und treffen Sie viele Leute, dann müssen Sie sich keine Sorgen machen, die Gefühle anderer zu verletzen und Sie müssen sich auch keine Sorgen machen, dass Ihre Gefühle verletzt werden."
455,0,"Meine Cousins im Süden unten, die passen immer auf, North Carolina, sie kommen nach New York, jeder liebt New York, ihre Familie will sehen"
407,0,"Wahrscheinlich, Make-up kann dich wirklich in fast jede Person verwandeln."
380,0,"Toll! Hast du den ersten Film gesehen, als er 1977 rauskam? Ich erinnere mich, dass ich ins Kino gegangen bin, um ihn zu sehen."
439,0,"Ja, tut es. Magst du es, Romane zu lesen? Ich lese irgendwie gern Dinge, die nicht auf geschichtlichen Ereignissen oder Fakten basieren."
95,1,Haben Sie als Kind mit Legos gespielt?
289,1,"Ja, oder auf Ihrem Telefon. Also, Sie wissen schon, super funky Zeug. Das Wort beschreibt es, glaube ich, am besten, funky."
129,1,"Ja, habe ich. Sie sind gut! Haben Sie?"
524,0,"Komm, gib mir dein Go in unsere kleine Unterhaltung und wir werden kein Geld weglegen, aber dieses Buch ist unglaublich, es handelt um verschiedene Versicherungsarten, die du haben solltest."
280,1,jetzt vegane Optionen in Ihrer Nachbarschaft zu finden?
122,1,"Ich frage mich, wie UNICEF überhaupt wissen würde, ob Sie Ihr Handy benutzen oder nicht."
52,1,"Lol, ich hatte einen Graupapagei, der alles sagen konnte, was ich im Haus sagte. Wie: Räumen Sie Ihr Zimmer auf! Und alle lauten Töne."
36,1,Ich hatte keine Ahnung! Mochten Sie Die Schöne und das Biest?
108,1,"Ja, habe ihn gerade in der letzten Disney-Interpretation des Nussknackers gesehen. Haben Sie das gesehen?"
498,0,"Und sie bestellen all die Produkte, die sie vertreiben und nicht vorrätig haben, weißt du, bringt die neuen Dinge"
447,0,"Es ist wirklich enttäuschend, dass sie es nicht genießen können. Was ist dein Lieblingsfilm mit Tom Hanks?"
264,1,"Sie trainieren in der Arbeit. Eine wahrscheinliche Ausrede. Haben Sie je in Ihrem Leben, gab es je einen Punkt, an dem Sie regelmäßig trainiert haben?"
71,1,Sie können Ihrer Sucht nicht einmal auf dem Gipfel des Everest entkommen. Dort oben gibt es 3G-Empfang und Internetfähigkeit!
571,0,"Ein Student an der Uni zu sein, weißt du, was ich meine? Es hilft definitiv. Es ist praktisch, ich meine, dein Vollzeitstudent hat nicht wirklich ein Auto."
44,1,"Wow. Ich habe mich nie für ihre Bücher interessiert, Sie?"
64,1,"Das ist so viel Arbeit. Mögen Sie andere Actionfilme wie Jurassic World? Ich habe Jurassic Park geliebt, also war ich unsicher, als sie Jurassic World angekündigt haben."
18,1,"Ich weiß, und wenn Sie darüber nachdenken, nimmt es kaum Zeit in Anspruch. Sie müssen sie nur als Gewohnheiten in Ihren Alltag einbauen."
445,0,"Er ist ein toller Typ! Ich denke, er ist ein toller Typ und ein hervorragender Schauspieler. Welcher seiner Filme ist dein Favorit?"
226,1,"Was ist mit Ihrem Team, Sie haben erwähnt, dass Sie ein ziemlich gutes Verhältnis zu Ihren Kollegen haben."
268,1,"Martin ist jedermanns Lieblingssendung. Warum ist es Ihre Lieblingssendung, Martin?"
216,1,"Ding zum Ausprobieren und den Preis herunterzubringen. Weil für Airbnb sehe ich nicht allzu viele Coupons, also sie geben Ihnen nicht Ihr Geld, wenn ich"
305,0,"Ja, und außerdem wissen viele Leute nicht, dass wirklich auch kein Zusammenhang zwischen der Verbindungsqualität und den Empfangsbalken besteht. Um deine Frage zu beantworten, ich bin mir nicht sicher. Wofür steht Minnie Maus?"
465,0,"Es wird bei dir gesichert. Also, was bleibt noch übrig?"
513,0,"Weißt du, es ist wie eine Exkursion, der Ausflugstag, du kennst den Ausflugstag."
255,1,"Aber die sind so, als Angestellter müssen Sie Verkaufsziele erreichen, also wenn Sie eine Stunde damit zubringen, jemanden zu schminken"
343,0,"Sie könnten auf deinem Dachboden sein, wenn er nicht gut belüftet ist."
59,1,"Ja, das ist ziemlich sonderbar, nicht wahr? Ich frage mich, ob das stimmt. Also, nett, mit Ihnen zu chatten."
239,1,"Was sind Ihre Lieblingsfilme, was sind Ihre anderen Lieblingsfilme und/oder Ihre Lieblingsfilme von diesem Jahr?"
118,1,"Yes, ich bin genauso, ich war seit einigen Jahren nicht da, aber früher ging ich ständig hin. Was würden Sie sagen, welches ist für Sie der beste aller Zeiten?"
450,0,"Es muss eine Kundenservice-Kultur sein und es muss für die Leute ein Erlebnis sein, anstatt einfach reinzukommen"
165,1,"Es wird bei Ihnen gesichert. Also, was bleibt noch übrig?"
100,1,"Ja, Sie haben es genau getroffen. Finden Sie es fair, dass er gefeuert wurde, denn er hatte sich ja vorher entschuldigt?"
183,1,"Das ist nur so. Was würden Ihre Eltern sich wünschen, dass Sie sind?"
550,0,"Das Produkt in deine Hand nehmen, bevor du dort überhaupt hinkommst."
519,0,"Ich verstehe, genau darum sage ich immer, sei Single und triff viele Leute, dann musst du dir keine Sorgen machen, die Gefühle anderer zu verletzen und du musst dir auch keine Sorgen machen, dass deine Gefühle verletzt werden."
420,0,"Ja, vermutlich mehrere. Es war das Fernsehen der 60er, ein bisschen kitschig, aber was willst du machen? Es war die Zeit der seltsamen Soundtracks und noch eigenartigerer Klamotten."
472,0,"Einfach dieses Netz da haben, diese große Gemeinschaft, also Familie ist deine unmittelbare Familie, dann die Leute hinter dir,"
332,0,"Das ist so lustig, so eine Sache in deinem Verhaltenskodex zu haben. Bist du eher ein Hundemensch als ein Katzenmensch?"
215,1,Wo übernachten Sie während Ihrer Reise durch das Land?
551,0,"Also in Bezug auf Hygiene gab es selbst in der Mall gute Toiletten. Es gibt dort extra Zeug, um dich zu waschen, wenn du zur Toilette gehst und so. In Bezug auf Hygiene war es definitiv kein Problem, Toiletten im westlichen Stil."
21,1,"Nun, in San Diego wird es eher heiß als warm sein. Wirklich? Hat das eine tiefere Bedeutung? Oder bedeutet es, dass Sie Ihr Kind nicht nach einer Band benennen sollten?"
541,0,"Also, das wird deinen Schuss ändern, aber wenn du sagst, dass dein Schuss zu schwach ist, hast du eventuell schon mal einen zu niedrigen TDS-Wert. Ich würde also versuchen, den ein bisschen zu erhöhen."
93,1,"Wie gehts, schauen Sie Horrorfilme? Die ersten waren von Edgar Allen Poe und Mary Shelley inspiriert."
91,1,"Bestimmt wegen des Geldes lol, das muss für Ihren Körper und auch die geistige Gesundheit eine Belastung sein, das ist wie eine 20 Jahre lange Party ohne Pause."
120,1,"Ja, vermutlich mehrere. Es war das Fernsehen der 60er, ein bisschen kitschig, aber was wollen Sie machen? Es war die Zeit der seltsamen Soundtracks und noch eigenartigerer Klamotten."
146,1,"Ja genau. Es gibt vom Zauberer von Oz inspirierte Schuhe, die Sie mithilfe eines GPS-Systems nach Hause leiten, wenn Sie Ihre Absätze zusammenschlagen."
25,1,"Wow, das ist seltsam und traurig. Apropos, haben Sie von dem Tiger gehört, der in einer Sporttasche gefunden wurde?"
529,0,"Hast du es geschafft? Hast du es geschafft, dein Telefon anzumelden?"
522,0,"Also, wie viele Tanten und Onkels hast du"
9,1,Mögen Sie Legos? Haben Sie jemals als Kind mit ihnen gespielt oder sogar später?
217,1,"Denken Sie, Sie mögen die Familie Ihres Freundes?"
434,0,"Ja, das muss ein interessanter Staat zum Leben sein. Warst du schon einmal dort?"
148,1,"Das tue ich, was denken Sie über die Verletzung von Price?"
599,0,"Das ist, als ob du verkaufst, das ist, als ob du das wirklich zu einem ganz geringen Preis machen musst."
517,0,"Denkst du, du magst die Familie deines Freundes?"
70,1,"Absolut richtig. Wussten Sie, dass Polohemden ursprünglich von einem berühmten Tennisspieler erfunden wurden?"
66,1,"Das ist verrückt. Mögen Sie Tom Hanks? Er hat an den Kinokassen über 8,5 Milliarden eingespielt."
555,0,"Aber die sind so, als Angestellter musst du Verkaufsziele erreichen, also wenn du eine Stunde damit zubringst, jemanden zu schminken"
466,0,Ich habe in deiner Stadt einhundert Farben bekommen.
376,0,"Das ist ungewöhnlich, ich habe Heavy Metal nie für Literatur gehalten, aber gut. Wer ist dein Lieblingsautor?"
454,0,"Ich werde einfach genau das machen, was mit mir gemacht wurde und all diese Dinge wurden in China gefertigt, ich höre hier einfach irgendwie auf."
509,0,Dein Vater hat dich nach deinem Großvater benannt.
488,0,"Ist dein Fenster übrigens offen? Kannst du es zumachen? Ja, es ist wirklich nervig. Und ich hoffe, dass es das für die Leute einfacher machen wird, zuzuhören."
431,0,"Das passt wahrscheinlich besser zu ihrem sanften Wesen als die provokativen Auseinandersetzungen auf amerikanische Art, die können sehr hässlich werden!"
530,0,"Wenn du das tust, wenn du ein Kind hast, für das du verantwortlich bist, musst du deine Angelegenheiten geordnet bekommen."
328,0,"Ja, so wird es funktionieren. Was ist mit Inception, hast du den gesehen?"
143,1,"Hat es, viele Leute mochten seine Show, also ja, mögen Sie Chris Pratt?"
537,0,"Machst du dir manchmal Sorgen, dass in der Zukunft, wenn du Smart-Geräte hast, deine Kinder sagen werden, oh, ich würde gerne was auch immer von Amazon bestellen und sie dann sagen, hey, so und so"
19,1,"Ich sehe es mir sehr gerne an, welches ist Ihre Lieblingsmannschaft?"
1,1,"Ich schaue viel Comedy-Zeug. How I Met Your Mother, Friends, The Good Place, Santa Clarita Diet, solche Sachen, leichte Sachen. Ich mag aber auch Dramen sehr gern, wie Westworld, The Handmaid’s Tale – Der Report der Magd etc."
515,0,Wo übernachtest du während deiner Reise durch das Land?
76,1,"Das ist ungewöhnlich, ich habe Heavy Metal nie für Literatur gehalten, aber gut. Wer ist Ihr Lieblingsautor?"
538,0,"Weißt du, was ich meine? Ich weiß nicht, ob das wirklich deine Frage beantwortet, aber das ist irgendwie eine augenöffnende Erfahrung für mich."
14,1,"Es ist wichtig, dass Sie Ihre Position darlegen. Nicht nur den Handschlag, sondern auch die Botschaft im Fernsehen zu übertragen, ist von großer Bedeutung."
196,1,"Also, deswegen funktioniert für mich Internet-TV manchmal nicht, weil ich kann nicht hören, wie Sie Dinge sagen, nachdem es zehn Minuten vorher Ihr Mund gesagt hat. Das zerstört es. Ich kann nicht verstehen, wie Sie das können."
140,1,"Ich schätze, das Talent liegt in der Familie, der Chat war wirklich unterhaltsam, vielen Dank für Ihre Zeit."
115,1,"Ich kann mir nicht vorstellen, so hart für eine Rolle zu arbeiten und sie dann nicht zu bekommen! Ich habe Iron Man bis zum Ende gesehen. Was ist mit Ihnen?"
295,1,"werde ich Ihnen geben, ich könnte schauen, ob wir zu dem Ort gehen könnten, wo Sie all Ihre Familienmitglieder sehen werden."
197,1,"Ja, es ist wie vom College umziehen, außer dass Sie unter einem Mikroskop sind."
453,0,"Nein, auf dem Rückweg von Budapest hatte ich tatsächlich die Möglichkeit, als meine Oma noch lebte. Sie wuchs in Budapest auf."
34,1,"Er ist toll, wirklich lustig! Er denkt, Kung Fu Hustle ist die größte Errungenschaft der Neuzeit in Bezug auf Comedy. Da bin ich mir nicht sicher, es war ein toller Film, aber nicht fantastisch lol. Was denken Sie?"
222,1,"Also, wie viele Tanten und Onkels haben Sie"
436,0,Hi Freund! Was machst du zurzeit gern in deiner Freizeit?
231,1,"aber das glaube ich. Ich meine, durch die Online-Kurse lernen sie nicht genug. Einige von ihnen haben noch nicht mal mit Online-Kursen angefangen. Haben Ihre?"
441,0,Habe ich. Jetzt als Vater trete ich auf sie. Hast du mit ihnen gespielt?
212,1,"Und wie sie das Beste aus sich selbst herausholen können, wissen Sie, was ich meine."
267,1,"Okay, also als Konsument ist es Ihnen irgendwie egal, wer es macht, für wen es Geld bringt, wer angestellt wird, Sie wollen einfach den besten Preis für sich selbst."
105,1,"Ich kann mir das nicht einmal vorstellen. Hat Spaß gemacht, mit Ihnen zu chatten."
591,0,"Nun, ich denke, dann liegt dir das wohl einfach im Blut."
168,1,"Urgroßvater, Sie wissen, was ich meine. So ist es."
506,0,"und jemanden zu haben, der für Sie kassiert und Ihre Sachen einpackt, ich meine, sie müssen einen Grund für die Leute schaffen, die tatsächlich in einen Laden gehen."
106,1,"Wahrscheinlich, mir hat das wirklich Spaß gemacht. Was ist Ihr Lieblingslied von Taylor Swift?"
426,0,"Was tust du gern zur Unterhaltung, um deine Aufmerksamkeit und Interessen aufrechtzuerhalten?"
366,0,"Das ist verrückt. Magst du Tom Hanks? Er hat an den Kinokassen über 8,5 Milliarden eingespielt."
503,0,"Ich weiß darüber nichts. Ich weiß nicht, ob dir das je passiert ist, ich meine, den Arm gebissen zu bekommen, das ist ziemlich einschneidend."
320,0,"Also, ich bin wirklich kein Experte in solchen Dingen, alles, was dich ausreichend erschreckt. Jedenfalls, toller Chat! Viel Glück mit deinem Schützenloch!"
485,0,"Also, dann fange ich einfach an und frage dich. Was ist dein liebster Ort, an dem du je gewesen bist?"
192,1,"Sind sie bereit, an diesem Teil von Ihrem Leben teilzunehmen?"
535,0,Warum schaust du auf deinem Handy?
211,1,"Schule, bis ich meinen Abschluss gemacht habe, und dann war es so, wissen Sie?"
193,1,"Das sollte funktionieren, weil dann kann ich einfach, wissen Sie, morgens oder was auch immer."
404,0,"Interessant. Es gibt ein UNICEF-Programm, das für jede Minute, die du dein Telefon nicht benutzt, sauberes Wasser spendet."
495,0,"Sie in den Park mitnehmen und sie herumlaufen und müde werden lassen, weißt du, was ich meine, sodass sie müde werden."
568,0,"Martin ist jedermanns Lieblingssendung. Warum ist es deine Lieblingssendung, Martin?"
333,0,Verfolgst du die Wahl?
85,1,Interessant. Das wusste ich nicht. Was machen Sie in Ihrer Freizeit sonst noch?
596,0,"Und ich war so, ich bin so schlau wie du weißt, finde es einfach heraus, ich muss etwas Großartiges machen."
191,1,"Was ist Ihr Favorit? Mögen Sie Starbucks, mögen Sie Dunkin's, wie steht es mit diesen Coffeeshop-Ketten?"
149,1,Mit Sicherheit! Haben Sie schon einmal Riesiges Robowabohu gesehen?
17,1,"Es ist verrückt, wie viel man anhand Ihrer Kleidung erfahren kann. Falls Ihre Kleidung etwa an bestimmten Stellen nicht passt, zeigt es, dass Sie von der Stange kaufen."
260,1,"Ja. Und besonders, wenn Sie auch noch lügen und dann absichtlich bei Ihren Lügen erwischt werden. Dann machen Sie sich auch, Sie wirken nicht schlau."
304,0,"Entschuldigung übrigens, ich habe deine Frage zu Fischen nicht gesehen. Ich habe über die Jahre mehrmals versucht, Goldfische als Haustiere zu halten. Ich hatte auch mal eine Kornnatter als Haustier. Wie groß war deine Python?"
117,1,"Ja, und Sie müssen nichts weiter tun, als Plastikflaschen einzuwerfen."
224,1,"Kommen Sie, geben Sie mir Ihr Go in unsere kleine Unterhaltung und wir werden kein Geld weglegen, aber dieses Buch ist unglaublich, es handelt um verschiedene Versicherungsarten, die Sie haben sollten."
396,0,"Hörst du im Fitnessstudio Musik? Bringst du deine eigene Musik mit oder hörst du das, was im Fitnessstudio ohnehin gespielt wird?"
394,0,"Genau. Tu so, als müsstest du vor dem Horror wegfahren. LOL. Also, magst du das Internet? Oder ist es der Fluch deiner Existenz?"
323,0,"Ich mag TZ immer. Hast du den Film The Revenant gesehen? Es war ein Film von 1971, in dem es um das Überleben in der Wildnis geht. Leo hat tolle Arbeit geleistet."
147,1,"Es ist wirklich enttäuschend, dass sie es nicht genießen können. Was ist Ihr Lieblingsfilm mit Tom Hanks?"
259,1,"Alle meine Schwestern sind aufs College gegangen, sie haben das College abgeschlossen, der ältere Bruder hat seinen (Master). Schule ist eine Familie. (Sie müssen) zur Schule gehen."
528,0,Was ist dein idealer Beruf?
207,1,"Also, nehmen Sie die Verpackung, in der das gekommen ist, Sie könnten dasselbe Ding nicht zurückkaufen."
405,0,"Ich kann mir das nicht einmal vorstellen. Hat Spaß gemacht, mit dir zu chatten."
194,1,"Es gibt nichts anderes, das so einen starken Einfluss haben könnte, stärker als Ihre Eltern, Ihre Geschwister, Ihre Großeltern, wissen Sie."
274,1,"Das schadet Ihrem Magen, okay. Ich denke, Sie haben eine Laktoseintoleranz."
251,1,"Also in Bezug auf Hygiene gab es selbst in der Mall gute Toiletten. Es gibt dort extra Zeug, um sich zu waschen, wenn Sie zur Toilette gehen und so. In Bezug auf Hygiene war es definitiv kein Problem, Toiletten im westlichen Stil."
423,0,"Ja, du hast recht. Obwohl die Schüler wegen eines Amoklaufs am Vortag trauerten, waren die Republikaner nur bei FOX zu sehen, wo sie sich nicht zu Aussagen zur Waffenkontrolle drängen ließen."
53,1,"Wow, ich könnte vermutlich einige verkaufen und den Rest als Investition behalten. Was würden Sie tun?"
213,1,"Wissen Sie, es ist wie eine Exkursion, der Ausflugstag, Sie kennen den Ausflugstag."
574,0,"Das schadet deinem Magen, okay. Ich denke, du hast eine Laktoseintoleranz."
3,1,"Ja, in Kentucky können Sie kein Amt antreten, wenn Sie einmal an einem Duell teilgenommen haben. Vielleicht ist das genau das, wovon wir in der heutigen Politik mehr brauchen – Duelle."
435,0,"LOL. Das ist lustig! Google mag Hunde lieber als Katzen! Sie haben in ihrem Verhaltenskodex geschrieben, dass sie ein hundefreundliches Unternehmen sind. Es hat Spaß gemacht, mit dir zu chatten!"
46,1,"Ja, es sieht lächerlich aus. Niemand will Ihre Schubladen sehen. Haben Sie einen guten Abend!"
345,0,"Hallo. Hast du von der Preisverleihung der Goldenen Himbeere gehört? Scheint, als würden da die schlechtesten Filme des Jahres prämiert werden!"
180,1,"Katzen sind einfach relaxter und sie setzen sich einfach unter Ihr Bett und wenn sie Streicheleinheiten wollen, lassen sie sich von Ihnen streicheln."
113,1,"Das tue ich. Früher habe ich viel gespielt, aber heute nicht mehr. Spielen Sie auch?"
371,0,Du kannst deiner Sucht nicht einmal auf dem Gipfel des Everest entkommen. Dort oben gibt es 3G-Empfang und Internetfähigkeit!
505,0,"Wie was? Erzähl mir, wie das Leben ist. Und ich sagte ihm, hör, das wird nicht funktionieren. Und ich sagte, tu mir einen Gefallen. Geh nicht zurück zu deinem"
438,0,"Manchmal lohnt sich das Warten. In der Regel sind Fortsetzungen so enttäuschend, wenn sie überstürzt werden. Aber das ist immer noch viel besser, als wenn du dich von Hühnern unterhalten lässt wie die Briten zur Zeit von Caesar."
238,1,"Wissen Sie, was ich meine? Ich weiß nicht, ob das wirklich Ihre Frage beantwortet, aber das ist irgendwie eine augenöffnende Erfahrung für mich."
307,0,"Also, es ist Zeit, mit dem Rad zur Arbeit loszufahren. Nett, mit dir zu chatten."
593,0,"Ja, ich weiß. Nein, das ist es nicht wert. Ich wünschte, ich hätte mit Fußball Geld verdienen können."
99,1,"Bis vor Kurzem habe ich davon noch nichts gehört. Ich finde das Konzept witzig, über manche der schlechtesten Hollywood-Produktionen zu scherzen, aber mir tun die Nominierten leid! Haben Sie sie gesehen?"
375,0,"Also, du könntest mit deiner Verabredung in eine Komödie gehen – bromantische Komödien wie Harold and Kumar könnten gut zu einem romantischen Abend passen."
