SID,label,sentence
360,0,"ट्रेन बढ़ रही है। आप बढ़ रहे हो। तुम समान गति से बढ़ रहे हो। अगर तुम ऊपर छलांग लगाओ, तुम्हारी गति में परिवर्तन नहीं आएगा। अगर वह मुड़े और तुम नहीं, तो तुम दीवार से टकरा जाओगे।"
200,1,"आपको उन्हें कोशिश करने जैसे मूल्य सिखाने होंगे, जैसे चीज़ों को इस तरह करने की कोशिश करना, आपको पता है कि मेरा क्या मतलब है?"
79,1,"हाय, क्या आपको डिज़्नी की फ़िल्में पसंद हैं?"
473,0,"जैसे तुम अपने सभी बीमा के लिए भुगतान करना जानते हो और गिग्स ढूँढने की कोशिश कर रहे हो, और गिग्स ले रहे हो जिन्हें तुम नहीं लेना चाहते हो"
338,0,"हाँ, मैं उस नजरिए को समझ सकता हूँ। मैं हमेशा सोचता था कि यह हमेशा से लाल और नीला था, लेकिन ज़ाहिराा तौर पर यह साल 2000 से शुरू हुआ था। हैरी ट्रूमैन पर तुम्हारे विचार क्या थे?"
8,1,"हाय, अपने टेलीफ़ोन का इस्तेमाल कितनी बार करना चाहिए? मैं अपने सेल फ़ोन का इस्तेमाल लगभग हर दिन करता हूँ, मेरे पास अब कोई लैंडलाइन भी नहीं है"
475,0,"यह काम से ज़्यादा ज़रूरी है, यह किसी नौकरी और करियर के होने से ज़्यादा ज़रूरी है, क्योंकि तुम्हारा करियर ख़त्म हो सकता है, तुम्हारा परिवार ख़त्म नहीं होगा। तुम्हारा परिवार बढ़ता रहेगा, तुम्हारा वंश बढ़ता रहेगा"
450,0,"इसे ग्राहक सेवा की संस्कृति होने और इसे लोगों के लिए न कि केवल आने के लिए, बल्कि एक अनुभव बनाने की ज़रूरत है"
415,0,मैं एक भूमिका के लिए इतनी मेहनत करने और उसे न पाने की कल्पना भी नहीं कर सकता! मैंने आयरनमैन पूरी की पूरी देखी है। और तुमने?
153,1,"नहीं, बुडापेस्ट से वापस जाने पर, असल में मुझे अवसर मिला था जब मेरी दादी जीवित थी। वे बुडापेस्ट में पली-बढ़ी थी।"
122,1,मैं सोचता हूँ कि UNICEF को इसका पता भी कैसे चलेगा कि आप अपने सेल फ़ोन का इस्तेमाल कर रहे थे या नहीं
117,1,हाँ और आपको बस उसे प्लास्टिक की बोतलें खिलानी होंगी
509,0,तुम अपने इंटरनेट बिल के लिए कितना भुगतान करते हो?
553,0,"लेकिन वे एक कर्मचारी की तरह होते हैं, जिनके पास पूरा करने के लिए सेल का लक्ष्य होता है और इसलिए अगर तुम किसी का मेकअप करने में एक घंटा लगा देते हो"
32,1,अपने कोड ऑफ़ कंडक्ट में ऐसी चीज का होना मजेदार होता है। क्या आपको बिल्लियों से ज़्यादा कुत्ते पसंद हैं?
433,0,"अगर मैं वहाँ रहता तो शायद मैं पूरी तरह से तैयार होता। सोचता हूँ कि क्या वहाँ रहने वाला कोई भी व्यक्ति, उन लोगों के लिए जो यात्रा करने के दौरान थककर किसी के घर पर आराम करते हैं, उनके लिए किसी वेबसाइट पर भाग लेता है।"
162,1,"यह हो सकता है, लेकिन उन्हें कॉस्मेटिक्स विभाग में भी काम करने वाले लोगों से उम्मीद रखने के तरीके को बदलना होगा"
374,0,"मैं सोचता हूँ कि खिलाड़ियों को खेल में जाने के लिए क्या चीज आकर्षित करती है। शायद यह पेचीदगी है, या शायद अपना खुद का व्यक्तिगत अंदाज़ बनाने का मौका।"
340,0,जबरदस्त। कार के ट्रंक को यह नाम इसलिए दिया गया क्योंकि पहले के ज़माने में वे लकड़ी के बने होते थे
420,0,"हाँ, शायद काफी ज़्यादा। यह 60 के दशक का टीवी था, कुछ दिखावटी, लेकिन तुम क्या कर सकते हो? वह समय ही अजीब साउंडट्रैक और अजीब कपड़ों का था।"
350,0,ये सच है। वो बड़े होकर एक सच्चे हीरो बने! तुम्हारा पसंदीदा बैटमैन कौन था?
14,1,"यकीन नहीं होता! ओह जज जूडी इतने सारे पैसे का आप क्या करती हो हाहा। खैर, बात करके अच्छा लगा, नमस्ते!"
121,1,"ये सच है, तो क्या कुछ और भी है जिसकी जानकारी हमें नहीं है हाहा। क्या आपको घोड़े अच्छे लगते हैं?"
346,0,"हाँ, यह दिखावट अजीब है। कोई भी तुम्हारी ड्रॉयर को देखना नहीं चाहेगा। गुड नाईट!"
347,0,"ये एक अच्छा सवाल है, कभी उसके बारे में सोचा नहीं। तुम लोगों को अपने काम के बारे में गंभीरता से कैसे समझाओगे, मैं यहाँ इसलिए हूँ कि हो सकता है परग्रही कभी हमसे संपर्क करें।"
22,1,गुड मॉर्निंग। आज आपके निवेश कैसे हैं?
126,1,अपना ध्यान लगाने और दिलचस्पी बनाए रखने के लिए मनोरंजन वास्ते आपको क्या करना पसंद है?
243,1,"जब आप छोटे थे तब आप वे चीज़़ें करना पसंद करते थे और आपके माता-पिता जो कहना चाहते थे आप उन्हें नहीं सुनना चाहते थे, आपको पता चलता है कि वे आपकी मदद करना चाह रहे थे और"
533,0,अपने फ़ोन पर क्यों देखना?
406,0,"शायद, मुझे बहुत मज़ा आया। टेलर स्विफ्ट का तुम्हारा पसंदीदा गाना कौनसा है?"
514,0,तुम देश भर में अपनी यात्रा के दौरान कहाँ ठहरते हो?
183,1,"ठीक, वे बस भाग्यशाली हैं और उनकी पैकेजिंग किसी दूसरी जगह से है।"
563,0,लगता है जैसे एक मिनट रुको। तुम्हारी बेटी कितने साल की है?
45,1,हाय। क्या आपने राज़ी पुरस्कारों के बारे में सुना है? यह साल की सबसे घटिया फ़िल्मों को पुरस्कृत करने के लिए होता है!
134,1,"हाँ, रहने के लिए एक दिलचस्प राज्य होगा। क्या आप कभी वहाँ गए हैं?"
369,0,"ओह तो Lacoste ने उसे बनाया था, बहुत दिलचस्प बात है, क्या तुमने बिल मे के संस्कार के बारे में सुना?"
531,0,"नहीं, मैं देख रहा हूँ कि तुम्हारा बड़ा है और मेरा लगभग सपाट है। मेरा वॉल्यूम बढ़ाया हुआ है और तुम्हेंं मेरे माइक्रोफ़ोन के बारे में पता है।"
304,0,मुझे दोनो पसंद हैं। मुझे लगता है कि वे साथ-साथ चलते हैं। शीशा नीचे करके जोर-जोर से अपने पसंदीदा गाने को गाते हुए सड़क से जाने जैसा कुछ नहीं होता।
154,1,"मेरा मतलब है कि मैं कभी-कभार ऐसा करता हूँ, अगर कोई ख़ास चीज़ है जिसे मैं ढूँढ रहा हूँ, जैसे मछली का एक अच्छा टुकड़ा या कुछ और या जो मुझे पता है कि जमा हुआ नहीं है"
492,0,"इससे काम हो जाना चाहिए तो मैं बस कर सकता हूँ, मतलब, सुबह या जो भी हो।"
100,1,हाँ आप बिलकुल सही हैं। क्या आपको लगता है कि उनकी गोलीबारी जायज थी क्योंकि उन्होंने पहले माफी मांग ली थी?
435,0,लोल यह मजेदार बात है! Google बिल्लियों की तुलना में कुत्तों को ज्यादा पसंद करते हैं! उन्होंने अपने आचार संहिता में लिखा है कि वे एक कुत्ते की कंपनी हैं। तुमसे बात करके मजा आया!
401,0,"अच्छी कार है, यह सच है कि गाड़ियों की चोरी को रोकने के लिए अपनी कार में फ़्लेमथ्रोवर्स रखना दक्षिण अफ्रीका में कानूनी है"
506,0,"तो तुम उस पैकेजिंग को ले लो, जो आई है, तुम वही चीज़ वापस नहीं ख़रीद सकते।"
592,0,"अच्छा है, लेकिन कैंसिल होने की वजह से चलो देखते हैं, तुम्हेंं समझ में आया? तुम्हेंं पता है, रुको मैं देख रहा हूँ, क्या हो सकता है? कहाँ? अभी तक अपनी फ़्लाइट कैंसिल क्यों नहीं की? अगर मैंने अपना टिकट लोकल से ख़रीदा है तो क्या मैं इसे कैंसिल कर सकता हूँ?"
486,0,"तुम स्कूल जाना चाहते हो, वे स्कूल जाने में तुम्हारी मदद करेंगे, तुम्हेंं पता है मैं क्या कह रहा हूँ, परिवार ऐसा ही होता है"
109,1,"जिंदगी बहुत छोटी है। मुझे लगता है कि अगर आप कर सकते हैं, तो आपको अपने सपनों का पीछा करना चाहिए।  मुझे रयान स्टाइल्स पसंद हैं।"
576,0,"तुम्हेंं पता है मैं क्या कह रहा हूँ, मुझे लगता है कि परिवार ही सब कुछ है जो हमें मिला है। हमें बस यही मिला है, सिर्फ़ वही लोग हैं जो तुम्हारी देखभाल करने वाले हैं।"
332,0,अपने कोड ऑफ़ कंडक्ट में ऐसी चीज का होना मजेदार होता है। क्या तुम्हेंं बिल्लियों से ज़्यादा कुत्ते पसंद हैं?
503,0,"हाँ, मेरा मतलब है और फिर प्रॉडक्ट के विनियमन के अलावा Amazon का दूसरा पहलू यह है कि कंपनी ख़ुद इतनी बड़ी हो रही है और इंडस्ट्री से Sony का हिस्सा ले रही है।"
327,0,"क्या उनका नाम ऐनी जोन्स है ? अगर हाँ, तो तुम अपनी किताबों पर जनरेटर लगाकर बिजली बेच सकते हो। क्या तुम्हेंं पढ़ने में मजा आता है ?"
232,1,आपकी माँ हमेशा ऐसी लगती है
367,0,"ये तो अच्छा आइडिया है! खैर, आज सुबह तुमसे बात करके मज़ा आया। उम्मीद है तुम्हारा शेष दिन अच्छा बीतेगा, दोस्त!"
74,1,"मैं सोचता हूँ कि खिलाड़ियों को खेल में जाने के लिए क्या चीज आकर्षित करती है। शायद यह पेचीदगी है, या शायद अपना खुद का व्यक्तिगत अंदाज़ बनाने का मौका।"
322,0,गुड मॉर्निंग। आज तुम्हारे निवेश कैसे हैं?
538,0,इसका मतलब यह नहीं है कि तुम्हारे काम के अनुभवों में बिल्कुल भी समानता नहीं है।
54,1,"हाँ, यह ऐसा लगता है, या शायद और ज़्यादा गति से घुमाया गया है, आपको पता है कि अगर एलियन हमारे ग्रह पर आते हैं या हमारे साथ संपर्क बनाने की कोशिश करते हैं तो उनके लिए हमारा एक एम्बेसडर है।"
163,1,"क्योंकि जब हम इसके बारे में सोचते हैं, तब यह अजीब लगता है कि यह ऐसा होता है"
21,1,"वैसे, सैन डिएगो गर्म से ज़्यादा तप्त होगा। सच में? क्या इसका कोई मतलब है? या इसका मतलब यह है कि आपको अपने बच्चे को बैंड के बाद कॉल नहीं करना चाहिए?"
548,0,तुम्हारे वहाँ पहुँचने से पहले ही प्रॉडक्ट को तुम्हारे हाथ में रख देना।
425,0,मुझे लगता है कि यह जीवन से सभी सुखों को दूर कर देगा। खाना? बीयर? वाइन? तुम अपने पूरे समय में करोगे क्या?
95,1,क्या आप बचपन में Lego से खेला करते थे?
400,0,हाँ तुम बिलकुल सही हो। क्या तुम्हेंं लगता है कि उनकी गोलीबारी जायज थी क्योंकि उन्होंने पहले माफी मांग ली थी?
330,0,"खैर, Netflix से DVD ऑर्डर करने के बाद भी उसे सूची में डालने के लिए तुम्हारे पास इंटरनेट होना चाहिए ताकि उसे भेजा जा सके।"
482,0,यह ऐसा ही है। तुम्हारे माता-पिता तुम्हेंं क्या बनना चाहते थे?
571,0,"तो यह सब चीज़़ें तुमने परिवार से पहले ही सीखी हैं, तो यह जाहिर तौर पर बहुत सी चीज़़ें हैं जो मैंने सीखी हैं, मूल्य जो मैंने सीखे हैं"
201,1,जब आपने अपने परिवार को बताया कि आप शाकाहारी हैं तो क्या उन्होंने कोई दबाव डाला?
288,1,"हाँ, आपको पता है मैं क्या कह रहा हूँ। समय बहुत तेज़ी से गुजरता है"
542,0,तो हम परिवारों और उनसे जुडी चीज़ों के बारे में बात करने जा रहे हैं और तुम यह सब जानते हो
413,0,हाँ। पहले मैं बहुत खेलता था लेकिन अब नहीं। क्या तुम भी खेलते हो?
527,0,क्या तुम करवा पाए? क्या तुम इसे अपने फ़ोन में साइन इन करवा पाए?
149,1,बेशक! क्या आपने कभी बिग हीरो 6 देखी है?
215,1,"इन चीज़ों को आज़माएँ और कीमत कम करें। क्योंकि Airbnb के लिए मुझे काफी ज़्यादा कूपन दिखाई नहीं देते, जैसे कि अगर मैं जाता हूँ तो वे आपको आपके पैसे नहीं देंगे"
199,1,"वह एक मज़ेदार यात्रा थी, उस यात्रा की आपकी सबसे अच्छी यादें कौन सी हैं?"
408,0,"हाँ, मैंने बस उन्हें सबसे नई वाली नटक्रैकर के डिज़्नी वाले वर्ज़न में देखा। क्या तुमने वह देखी है?"
127,1,"तब तो बहुत बढ़िया हो जाएगा, खासकर फिनलैंड में... हाहा लगता है मैंने आपकी टिप्पणी को गलत पढ़ लिया।"
106,1,"शायद, मुझे बहुत मज़ा आया। टेलर स्विफ्ट का आपका पसंदीदा गाना कौनसा है?"
813,1,あなたの子供たちとかにはどんなことを望んでいますか。全部把握できるなら。あなたのご両親はあなたやあなたの子供たちをどう扱ってきましたか。 え、どうやってやりますか？
1459,0,何が起こっているのか、私のネットワーク上で何か変なことが起こっているのか......今、私の声が聞こえる？
670,1,幸いなことに、私の仕事にはそのような時間があります。とはいえ、この世界的なパンデミックでみんな家にいるので、今はたくさん教えています。
1465,0,両方ともリサーチしないといけないね。それから、私の友人は、ブラックフライデーの頃か何かだったと思う。
789,1,映画は携帯電話でも視聴が大幅に減少しています。ということは携帯電話ではテレビを観ている人が多いんだと思います。私は携帯電話でテレビを観たことはありません。そういうものは観ません。でも、携帯電話でYouTube動画だけは観ています。
845,1,ニューヨークのブルーミントンにもあるレストラン。お気に入りのレストランはどれですか？
1370,0,これは素晴らしいことです。私がギリシャに行ったのは、本当に親しい友人が彼女の夫と話をすることになっていたからだ。
110,1,何？ 本当に？ それは馬鹿げています！ しかし、やっぱり私は量子コンピューターの設計に取り組んでいるので、私自身いくつか奇妙なものを見てきました。笑笑 物理は一般的に異様だと思いませんか？
86,1,うん、PCが多すぎるのは私は時代遅れだと思いますね。好きなコンテンツを作ればいいと思います。それが悪い場合は悪いんです。見る人はそれがひどいから気に入らないのでしょう。
831,1,どうしてあなたは電話でそれをしませんか？あなたは何が好きではありませんか？
264,1,私もありません。それが脳の中で何かを誘発するんだと思います。少しばかげていますが。好きなユニフォームはありますか?
1607,0,まあ、それはあなたの血の中にあると思うよ。
1734,0,私の人生の色んなステージで、ほら、家族、努力、献身、忠実、正直さ。だから私の子供たちがそれを学んで自分たちの家族を大切にしてくれれば
1057,0,"ねえ、あなたは決して年を取りすぎてなんかいないよ。私自身孫がいるんだ！笑 私は孫と一緒にビッグ・ヒーロー・シックスを見たよ、素敵な可愛いアニメ映画だね。 55,000コアのスパコンでレンダリングされた素晴らしいグラフィックだった。"
1737,0,彼らの人生でその段階まで成長して、色んなことに直面する、ほら
189,1,最近、オーストラリア人の声からイギリス人の声に切り替えました。女性に対し飽きずに関心を持ち続ける必要がありますから!
1193,0,私もだよ！ザ・ルームを見たことがある？それは私のお気に入りのひどい映画だよ、彼らは実際にトミー・ウィソーと一緒にディザスター・アーティストと呼ばれるカルト信者についての映画を作った。これについて聞いたことがある？間違いなくラジー賞に値するよ@
975,0,子供たちを怖い映画に連れていくのが好きなんだ。そうすれば、子供たちは私と一緒に美術館に行って楽しんでくれるようになるからね。
1049,0,私も同感だよ！ほら...私は寝ることが大好きだが、アラスカから北メキシコまで眠らずに渡る鳥がいるんだ。かなり疲れるよね！
1517,0,アマゾンやハイエンドスニーカー商品、そして洋服をネットで見るなど、私もこれの犠牲者であることはわかっている。
163,1,私がウェンディーズを去った日に自分がショックを受けたのはわかっています、私の電話は私の訪問がどうだったか私に尋ねました！ 娘は大笑いしました。
